jadwal keberangkatan kapal bukit raya dihari rabu,bukitraya_rabu_tidakada
kapal bukit raya dihari rabu,bukitraya_rabu_tidakada
jadwal kapal bukit raya untuk hari rabu,bukitraya_rabu_tidakada
jadwal kapal bukit raya untuk hari sabtu,bukitraya_sabtu_tidakada
jadwal keberangkatan kapal bukit raya untuk hari sabtu,bukitraya_sabtu_tidakada
kapal bukit raya dihari sabtu,bukitraya_sabtu_tidakada
jadwal keberangkatan kapal bukit raya dihari selasa,bukitraya_selasa_tidakada
jadwal kapal bukit raya untuk hari selasa,bukitraya_selasa_tidakada
kapal bukit raya dihari selasa,bukitraya_selasa_tidakada
jadwal kapal bukit raya untuk hari senin,bukitraya_senin_tidakada
kapal bukit raya dihari senin,bukitraya_senin_tidakada
jadwal keberangkatan kapal bukit raya di hari senin,bukitraya_senin_tidakada
kapal fery di hari minggu,fery_minggu_tidakada
jadwal kapal fery untuk hari minggu,fery_minggu_tidakada
jadwal keberangkatan kapal fery dihari minggu,fery_minggu_tidakada
jadwal kapal fery hari rabu,fery_rabu_tidakada
kapal fery di hari rabu,fery_rabu_tidakada
jadwal keberangkatan kapal fery untuk hari rabu,fery_rabu_tidakada
jadwal keberangkatan kapal fery di hari sabtu,fery_sabtu_tidakada
jadwal kapal fery di hari sabtu,fery_sabtu_tidakada
kapal fery untuk hari sabtu,fery_sabtu_tidakada
jadwal kapal fery hari selasa,fery_selasa_tidakada
jadwal kapal fery untuk hari selasa,fery_selasa_tidakada
kapal fery untuk hari selasa,fery_selasa_tidakada
kapal iguana dihari jumat,iguana_jumat_tidakada
jadwal keberangkatan kapal iguana dihari jumat,iguana_jumat_tidakada
jadwal kapal untuk hari jumat,iguana_jumat_tidakada
kapal iguana dihari kamis,iguana_kamis_tidakada
jadwal kapal untuk hari kamis,iguana_kamis_tidakada
jadwal keberangkatan kapal iguana dihari kamis,iguana_kamis_tidakada
kapal iguana dihari rabu,iguana_rabu_tidakada
jadwal keberangkatan kapal iguana dihari rabu,iguana_rabu_tidakada
jadwal kapal untuk hari rabu,iguana_rabu_tidakada
jadwal keberangkatan kapal iguana dihari selasa,iguana_selasa_tidakada
jadwal kapal iguana untuk hari selasa,iguana_selasa_tidakada
kapal iguana dihari selasa,iguana_selasa_tidakada
kapal untuk hari jumat apa saja,jadwal_jumat
kapal apa saja yang berangkat hari jumat,jadwal_jumat
kapal hari jumat,jadwal_jumat
kapal jum'at,jadwal_jumat
kapal untuk hari kamis apa saja,jadwal_kamis
kapal hari kamis,jadwal_kamis
kapal apa saja yang berangkat hari kamis,jadwal_kamis
kapan kapal bukit raya berangkat,jadwal_kapal_bukit_raya
jadwal keberangkatan kapal bukit raya,jadwal_kapal_bukit_raya
jadwal keberangkatan kapal fery,jadwal_kapal_fery
kapan kapal fery berangkat,jadwal_kapal_fery
jadwal keberangkatan kapal iguana,jadwal_kapal_iguana
kapan kapal iguana berangkat,jadwal_kapal_iguana
jadwal keberangkatan kapal marina,jadwal_kapal_marina
kapan kapal marina berangkat,jadwal_kapal_marina
jadwal kapal oceana,jadwal_kapal_oceana
kapan jadwal keberangkatan kapal oceana,jadwal_kapal_oceana
jam berapa dan hari apa saja kapal oceana gerak,jadwal_kapal_oceana
apakah hariini ada kapal yang berangkat,jadwal_kapal_umum
jadwal seluruh kapal,jadwal_kapal_umum
jadwal kapal,jadwal_kapal_umum
ada berapa kapal yang tersedia,jadwal_kapal_umum
ada kapal apa saja,jadwal_kapal_umum
kapal apa saja,jadwal_kapal_umum
kapal hari minggu,jadwal_minggu
kapal untuk hari minggu apa saja,jadwal_minggu
kapal apa saja yang berangkat hari minggu,jadwal_minggu
kapal hari rabu,jadwal_rabu
kapal untuk hari rabu apa aja,jadwal_rabu
kapal apa saja yang berangkat hari rabu,jadwal_rabu
kapal apa aja yang berangkat hari sabtu,jadwal_sabtu
kapal untuk hari sabtu apa saja,jadwal_sabtu
kapal hari sabtu,jadwal_sabtu
kapal hari selasa,jadwal_selasa
kapal untuk hari selasa apa aja,jadwal_selasa
kapal apa saja yang berangkat hari selasa,jadwal_selasa
kapal untuk hari senin apa saja,jadwal_senin
kapal apa saja yang berangkat hari senin,jadwal_senin
kapal hari senin,jadwal_senin
kapal marina dihari jumat,marina_jumat_tidakada
jadwal keberangkatan kapal marina hari jumat,marina_jumat_tidakada
jadwal keberangkatan kapal marina di hari jumat,marina_jumat_tidakada
kapal marina dihari kamis,marina_kamis_tidakada
jadwal kapal marina untuk hari kamis,marina_kamis_tidakada
jadwal keberangkatan kapal marina dihari kamis,marina_kamis_tidakada
jadwal kapal marina untuk hari minggu,marina_minggu_tidakada
kapal marina dihari minggu,marina_minggu_tidakada
jadwal keberangkatan kapal marina di hari minggu,marina_minggu_tidakada
jadwal kapal marina untuk hari senin,marina_senin_tidakada
jadwal keberangkatan kapal marina dihari senin,marina_senin_tidakada
kapal marina dihari senin,marina_senin_tidakada
kapal fery,menanyakan_kapal_hariini
kapal hariini,menanyakan_kapal_hariini
kapal oceana hariini,menanyakan_kapal_hariini
kapal marina,menanyakan_kapal_hariini
kapal iguana,menanyakan_kapal_hariini
kapal bukit raya,menanyakan_kapal_hariini
kapal oceana di hari jumat,oceana_jumat_tidakada
oceana hari jumat,oceana_jumat_tidakada
jadwal kapal oceana untuk hari jumat,oceana_jumat_tidakada
oceana dihari kamis,oceana_kamis_tidakada
jadwal kapal oceana hari kamis,oceana_kamis_tidakada
jadwal kapal oceana di hari minggu,oceana_minggu_tidakada
oceana di hari minggu,oceana_minggu_tidakada
kapal oceana untuk hari minggu,oceana_minggu_tidakada
oceana di hari sabtu,oceana_sabtu_tidakada
jadwal kapal oceana di hari sabtu,oceana_sabtu_tidakada
kapal oceana di hari sabtu,oceana_sabtu_tidakada
kapal Ferry,penulisan_kapal_salah
harga tiket kapal bukit raya tuuan lingga,tiket_bukitraya
harga tiket ke lingga,tiket_bukitraya
harga tiket bukit raya,tiket_bukitraya
berapa harga tiket kapal bukit raya,tiket_bukitraya
tiket batam,tiket_fery
berapa harga tiket kapal fery,tiket_fery
tiket kapal fery,tiket_fery
berapa harga tiket kapal fery tujuan batam,tiket_fery
harga tiket ke anambas,tiket_iguana
berapa harga tiket kapal iguana tujuan anambas,tiket_iguana
harga tiket kapal iguana,tiket_iguana
berapa harga tiket kapal iguana,tiket_iguana
tiket anambas,tiket_iguana
berapa harga tiket kapal marina,tiket_marina
tiket ke karimun,tiket_marina
tiket kapal marina,tiket_marina
harga tiket kapal marina,tiket_marina
harga tiket kapal marina tujuan karimun,tiket_marina
harga tiket kapal oceana tujuan natuna,tiket_oceana
tiket ke natuna,tiket_oceana
berapa harga tiket kapal oceana,tiket_oceana
tiket kapal oceana,tiket_oceana
tujuan kapal bukit raya hari jumat,tujuan_bukitraya_lingga
kapal tujuan lingga,tujuan_bukitraya_lingga
hari apa saja kapal ke lingga,tujuan_bukitraya_lingga
kapal bukit raya ke lingga,tujuan_bukitraya_lingga
tujuan kapal bukit raya hari minggu,tujuan_bukitraya_lingga
tujuan kapal bukit raya hari kamis,tujuan_bukitraya_lingga
tujuan kapalfery hari kamis,tujuan_fery_batam
tujuan kapal fery hari jumat,tujuan_fery_batam
hari apa saja kapal batam,tujuan_fery_batam
kapal tujuan batam,tujuan_fery_batam
kapal fery ke batam,tujuan_fery_batam
tujuan kapal fery hari senin,tujuan_fery_batam
hari apa saja kapal anambas,tujuan_iguana_anambas
tujuan kapal iguana hari senin,tujuan_iguana_anambas
tujuan kapal iguana hari sabtu,tujuan_iguana_anambas
kapal iguana ke anambas,tujuan_iguana_anambas
kapal tujuan anambas,tujuan_iguana_anambas
tujuan kapal iguana hari minggu,tujuan_iguana_anambas
kapal marina ke karimun,tujuan_marina_karimun
kapal yang tujuannya karimun,tujuan_marina_karimun
tujuan kapal marina hari sabtu,tujuan_marina_karimun
tujuan kapal marina hari rabu,tujuan_marina_karimun
tujuan kapal iguana hari selasa,tujuan_marina_karimun
hari apa saja yang ke karimun,tujuan_marina_karimun
hari apa saja kapal ke natuna,tujuan_oceana_natuna
kapal ke natuna,tujuan_oceana_natuna
tujuan kapal oceana hari senin,tujuan_oceana_natuna
tujuan kapal oceana hari selasa,tujuan_oceana_natuna
tujuan kapal oceana hari rabu,tujuan_oceana_natuna
kemana saja kapal oceana berangkat,tujuan_oceana_natuna
